{
  "$schema": "https://json-schema.org/draft/2020-12/schema",
  "type": "object",
  "additionalProperties": false,
  "required": ["schema_version"],
  "properties": {
    "schema_version": {"const": 1},
    "repairs": {"type": "array", "uniqueItems": true, "items": {"enum": ["opening_cell", "overprint", "split_at_rules", "stacked_rows"]}},
    "codes": {"const": "right"},
    "rules": {
      "type": "object",
      "additionalProperties": false,
      "properties": {
        "dark": {"type": "integer", "minimum": 129, "maximum": 255}
      }
    },
    "accounts": {
      "type": "object",
      "propertyNames": {"minLength": 1},
      "additionalProperties": {
        "type": "object",
        "additionalProperties": false,
        "properties": {
          "columns": {"$ref": "#/properties/columns"},
          "spread": {"$ref": "#/properties/spread"},
          "header": {"$ref": "#/properties/header"},
          "breakdown": {"$ref": "#/properties/breakdown"}
        }
      }
    },
    "columns": {
      "type": "object",
      "propertyNames": {"minLength": 1},
      "additionalProperties": {
        "type": "object",
        "additionalProperties": false,
        "properties": {
          "kind": {"enum": ["amount", "label", "ignore"]},
          "axis_header": {"type": "string", "minLength": 1},
          "inline": {"type": "boolean"},
          "heading": {"type": "string", "minLength": 1}
        }
      }
    },
    "spread": {
      "type": "object",
      "additionalProperties": false,
      "required": ["gutter"],
      "properties": {
        "gutter": {"type": "number", "exclusiveMinimum": 0, "exclusiveMaximum": 1}
      }
    },
    "header": {
      "type": "object",
      "additionalProperties": false,
      "properties": {
        "ignore_frame_title": {"type": "boolean"}
      }
    },
    "source_inconsistencies": {
      "type": "array",
      "items": {
        "type": "object",
        "additionalProperties": false,
        "required": ["table_id", "page", "axis", "parent", "printed", "children_sum", "difference", "basis"],
        "properties": {
          "table_id": {"type": "string", "minLength": 1},
          "page": {"type": "integer", "minimum": 1},
          "axis": {"type": "string", "minLength": 1},
          "parent": {
            "type": "object",
            "additionalProperties": false,
            "required": ["code", "name"],
            "properties": {
              "code": {"type": ["string", "null"]},
              "name": {"type": "string", "minLength": 1}
            }
          },
          "printed": {"type": "integer"},
          "children_sum": {"type": "integer"},
          "difference": {"type": "integer"},
          "basis": {"type": "string", "minLength": 10}
        }
      }
    },
    "breakdown": {
      "type": "object",
      "propertyNames": {"minLength": 1},
      "additionalProperties": {
        "type": "object",
        "additionalProperties": false,
        "properties": {
          "marks": {
            "type": "object",
            "propertyNames": {"minLength": 1},
            "additionalProperties": {
              "oneOf": [{"type": "integer", "minimum": 1}, {"const": "説明"}]
            }
          },
          "fitted_names": {
            "type": "object",
            "additionalProperties": false,
            "required": ["chars", "overflow_left_chars"],
            "properties": {
              "chars": {"type": "integer", "minimum": 1},
              "overflow_left_chars": {"type": "integer", "minimum": 0}
            }
          },
          "wrap": {"const": "amount_on_last_line"},
          "hang_chars": {"type": "integer", "minimum": 1},
          "names_end_with_kind_words": {"type": "boolean"},
          "bracketed_remainder": {"type": "boolean"},
          "name_columns": {"type": "boolean"},
          "note_kinds": {
            "type": "object",
            "propertyNames": {"minLength": 1},
            "additionalProperties": {"type": "string", "minLength": 1}
          },
          "plain_names": {"type": "array", "items": {"type": "string", "minLength": 2}},
          "amount_brackets": {"type": "boolean"},
          "indent_chars": {"type": "integer", "minimum": 1},
          "single_part_notes": {"type": "boolean"},
          "rows": {"type": "boolean"},
          "rows_from": {
            "type": "object",
            "additionalProperties": false,
            "required": ["name", "amount"],
            "properties": {"name": {"type": "string", "minLength": 1}, "amount": {"type": "string", "minLength": 1}}
          },
          "sum_levels": {"type": "boolean"},
          "bare_amounts": {"type": "boolean"},
          "notes": {"type": "array", "items": {"type": "string", "minLength": 1}}
        }
      }
    }
  }
}
