{
 "schema_version": 1,
 "columns": {
  "主管課": {
   "kind": "ignore"
  },
  "事業説明": {
   "kind": "ignore"
  },
  "財源内訳／特定財源": {
   "kind": "amount",
   "inline": true
  },
  "金額": {
   "heading": "決算額"
  },
  "節／金額": {
   "heading": "決算額"
  }
 },
 "breakdown": {
  "事業名": {
   "rows": true,
   "rows_from": {
    "name": "主管課",
    "amount": "決算額"
   }
  },
  "節説明": {
   "amount_brackets": true,
   "sum_levels": true,
   "bare_amounts": true
  }
 },
 "repairs": [
  "split_at_rules",
  "stacked_rows"
 ]
}
